,school_name,address,Ambitious_Instruction,Collaborative_Teachers,Effective_Leaders,Involved_Families,Supportive_Environment,signed_silhouettes,income
593,Wendell Phillips Academy High School,"244 E Pershing Rd, Chicago, IL 60653",85.0,61.0,57.0,41.0,58.0,0.12386612798269199,18464.0
594,Wendell Smith Elementary School,"744 E 103rd St, Chicago, IL 60628",77.0,44.0,47.0,45.0,76.0,0.3166264892677738,47232.0
595,West Park Elementary Academy,"1425 N Tripp Ave, Chicago, IL 60651",55.0,38.0,32.0,54.0,26.0,0.7196293065330294,41711.0
596,West Ridge Elementary School,"6700 N Whipple St, Chicago, IL 60645",71.0,53.0,51.0,59.0,56.0,0.35203878259050153,52022.0
597,Whitney M Young Magnet High School,"211 S Laflin St, Chicago, IL 60607",91.0,64.0,57.0,93.0,79.0,-0.6286604685796973,59427.0
598,Wildwood IB World Magnet School,"6950 N Hiawatha Ave, Chicago, IL 60646",67.0,61.0,49.0,97.0,50.0,-0.23504715637408483,74229.0
599,Willa Cather Elementary School,"2908 W Washington Blvd, Chicago, IL 60612",58.0,67.0,51.0,63.0,28.0,0.4189848825680956,31941.0
600,William B Ogden Elementary School,"24 W Walton St, Chicago, IL 60610",,34.0,31.0,72.0,,0.5382480758169419,70682.0
601,William Bishop Owen Scholastic Academy ES,"8247 S Christiana Ave, Chicago, IL 60652",77.0,66.0,71.0,82.0,38.0,-0.3821163377446987,64997.0
602,William C Reavis Math & Science Specialty ES,"834 E 50th St, Chicago, IL 60615",96.0,82.0,76.0,81.0,87.0,-0.7206234087160291,41344.0
603,William C. Goudy Technology Academy,"5120 N Winthrop Ave, Chicago, IL 60640",76.0,74.0,67.0,66.0,48.0,-0.45898088048154,44410.0
604,William E B Dubois Elementary School,"330 E 133rd St, Chicago, IL 60827",75.0,51.0,60.0,43.0,43.0,0.5138072914755245,39986.0
605,William E Dever Elementary School,"3436 N Osceola Ave, Chicago, IL 60634",82.0,78.0,73.0,75.0,36.0,-0.46351077979669414,62214.0
606,William F Finkl Elementary School,"2332 S Western Ave, Chicago, IL 60608",93.0,74.0,53.0,85.0,64.0,-0.6404449851153498,33821.0
607,William G Hibbard Elementary School,"3244 W Ainslie St, Chicago, IL 60625",70.0,68.0,58.0,69.0,51.0,-0.2630498939085157,53288.0
608,William H Brown Elementary School,"54 N Hermitage Ave, Chicago, IL 60612",70.0,19.0,30.0,21.0,57.0,0.6076616904284977,31941.0
609,William H Prescott Elementary School,"1632 W Wrightwood Ave, Chicago, IL 60614",61.0,66.0,67.0,81.0,74.0,-0.32580364619005564,93702.0
610,William H Ray Elementary School,"5631 S Kimbark Ave, Chicago, IL 60637",68.0,66.0,63.0,76.0,36.0,-0.09850042184107191,30244.0
611,William H Ryder Math & Science Specialty ES,"8716 S Wallace St, Chicago, IL 60620",87.0,66.0,59.0,72.0,93.0,-0.5974283439685758,45717.0
612,William H Seward Communication Arts Academy ES,"4600 S Hermitage Ave, Chicago, IL 60609",59.0,53.0,42.0,35.0,52.0,0.6443386266501201,31357.0
613,William Howard Taft High School,"6530 W Bryn Mawr Ave, Chicago, IL 60631",70.0,55.0,41.0,58.0,51.0,0.4268196751591835,67465.0
614,William J Bogan High School,"3939 W 79th St, Chicago, IL 60652",60.0,65.0,50.0,62.0,51.0,0.23734581725042925,64997.0
615,William J Onahan Elementary School,"6634 W Raven St, Chicago, IL 60631",69.0,62.0,56.0,75.0,46.0,-0.09412950469437371,67465.0
616,William Jones College Preparatory High School,"700 S State St, Chicago, IL 60605",96.0,55.0,43.0,89.0,85.0,-0.4519352104547945,64706.0
617,William K New Sullivan Elementary School,"8331 S Mackinaw Ave, Chicago, IL 60617",94.0,62.0,58.0,62.0,78.0,-0.5247159527776166,43572.0
618,William P Gray Elementary School,"3730 N Laramie Ave, Chicago, IL 60641",79.0,89.0,71.0,79.0,53.0,-0.6706732601859308,54544.0
619,William P Nixon Elementary School,"2121 N Keeler Ave, Chicago, IL 60639",80.0,69.0,66.0,60.0,49.0,-0.3499426612654203,50923.0
620,William Penn Elementary School,"1616 S Avers Ave, Chicago, IL 60623",98.0,64.0,48.0,79.0,53.0,-0.4329413810161905,34670.0
621,William Rainey Harper High School,"6520 S Wood St, Chicago, IL 60636",62.0,71.0,47.0,53.0,53.0,0.30746104868318586,33080.0
622,William T Sherman Elementary School,"1000 W 52nd St, Chicago, IL 60609",99.0,74.0,73.0,58.0,98.0,-0.5636759885560461,31357.0
623,William W Carter Elementary School,"5740 S Michigan Ave, Chicago, IL 60637",69.0,82.0,71.0,56.0,33.0,-0.12197808756798945,30244.0
624,Wilma Rudolph Elementary Learning Center,"1628 W Washington Blvd, Chicago, IL 60612",,31.0,40.0,44.0,,0.6917293854068783,31941.0
625,Wolfgang A Mozart Elementary School,"2200 N Hamlin Ave, Chicago, IL 60647",63.0,45.0,34.0,53.0,46.0,0.7185472875455267,46572.0
626,Woodlawn Community Elementary School,"6657 S Kimbark Ave, Chicago, IL 60637",99.0,73.0,61.0,74.0,71.0,-0.650383867964048,30244.0
627,World Language Academy High School,"3120 S Kostner Ave, Chicago, IL 60623",80.0,62.0,56.0,61.0,65.0,-0.292499529176474,34670.0
628,YCCS - Association House HS,"1116 N Kedzie, 4th Floor Ave, Chicago, IL 60651",41.0,82.0,72.0,24.0,44.0,0.2725187446536077,41711.0
629,YCCS - Chatham AcademyHS,"9035 S Langley Ave, Chicago, IL 60619",76.0,38.0,46.0,55.0,76.0,0.30063169583974564,42754.0
630,YCCS - Dr. Pedro Albizu Campos Puerto Rican HS,"2739 W Division St, Chicago, IL 60622",67.0,23.0,29.0,25.0,57.0,0.6341047974157834,54344.0
631,YCCS - Innovations HS of Arts Integration,"17 N State St, Chicago, IL 60602",47.0,45.0,48.0,18.0,47.0,0.6074208391492812,25272.0
632,YCCS - Jane Addams Alternative HS,"1814 S Union Ave, Chicago, IL 60616",99.0,99.0,98.0,99.0,92.0,-0.6468238760074261,41111.0
633,YCCS - McKinley Lakeside Leadership HS,"2920 S Wabash Ave, Chicago, IL 60616",57.0,18.0,7.0,,49.0,0.6365304081980881,41111.0
634,YCCS - Olive Harvey Middle College HS,"10001 S Woodlawn Ave, Chicago, IL 60628",68.0,58.0,55.0,,48.0,0.4032252760032895,47232.0
635,YCCS - Sullivan House Alternative HS,"8164 S South Chicago Ave, Chicago, IL 60617",89.0,59.0,67.0,48.0,60.0,-0.2109913871486197,43572.0
636,YCCS - Truman Middle College HS,"1145 W Wilson Ave, Chicago, IL 60640",62.0,48.0,45.0,32.0,64.0,0.5895072325277588,44410.0
637,YCCS - West Town Acad Alternative HS,"500 N Sacramento Blvd, Chicago, IL 60612",,59.0,50.0,25.0,,0.5763939091754715,31941.0
638,YCCS - Youth Connection Leadership Acad HS,"3424 S State St, Chicago, IL 60616",39.0,52.0,57.0,,39.0,0.6129331211078681,41111.0
639,Young Women's Leadership Charter School,"2641 S Calumet Ave, Chicago, IL 60616",91.0,61.0,60.0,57.0,57.0,-0.29917960279327266,41111.0
